<!ELEMENT SpecialOrder (Product)* >
<!ATTLIST SpecialOrder CustomerID CDATA #REQUIRED>
<!ATTLIST SpecialOrder OrderDate CDATA #REQUIRED>
<!ELEMENT Product (Name, Quantity, Price)>
<!ATTLIST Product ProductID CDATA #REQUIRED>
<!ELEMENT Name (#PCDATA)>
<!ELEMENT Quantity (#PCDATA)>
<!ELEMENT Price (#PCDATA)>

