<?xml version="1.0"?>
<!DOCTYPE OldOrder SYSTEM "SpecialOrder.dtd">
<SpecialOrder CustomerID="ALFKI" OrderDate="6/1/2002">
<Product ProductID="1">
	<Name>Chai</Name>
	<Quantity>5</Quantity>
	<Price>18.00</Price>
</Product>
<Product ProductID="2">
	<Name>Chang</Name>
	<Quantity>10</Quantity>
	<Price>19.00</Price>
</Product>
</SpecialOrder>
